reviewerID,asin,overall,overall_new,reviewText,filteredReviewText
212,9,1,1,"Returning these. the pictures on here make the shoe appear all black with a touch of pink in the check. however, the whole shoe has pink coming through. I was looking for an all black shoe. I ordered the Nike Women's Flex Supreme TR3 instead and love them!!!",I ordered the Nike Women 's Flex Supreme TR3 instead and love them ! ! !
195,19,5,5,"Size 8, but purchased 8.5 for a more comfortable feel, considering shrinkage as a result of perspiration.","but purchased 8.5 for a more comfortable feel , considering shrinkage as a result of perspiration ."
268,27,5,5,"love these shoes. Workout in them 3-4 times a week at the gym. I do treadmill, stairmaster, cardio classes and weight lifting. lightweight and versatile shoe.",love these shoes . and versatile shoe .
127,30,2,2,"I'm not sure I was shipped the correct style.  The ones I received are a lot clunkier than I expected, although the quality is fine.",I am not sure I was shipped the correct style . although the quality is fine .
220,20,3,3,"This is a shoe I will wear with black dress pants or jeans when I need comfort and a little style, but I am not impressed.  This is a very flimsy shoe with little support at all.  Not like any Nike I've ever purchased in the past.  It looks nice, but it's not comfortable.","when I need comfort but I am not impressed . This is a very flimsy shoe with little support at all . Not like any Nike It looks nice , but it is not comfortable ."
394,6,5,5,Excellent,Excellent
159,6,5,5,I really love these shoes.  They are attractive and very comfortable.  They work well for my daily workout and fit well.,I really love these shoes . They are attractive and very comfortable . They work well for my daily workout and fit well .
176,20,4,4,I was really excited when I opened the box to see the color is exactly like the image shows! I have the Nike flex tr 5 and used the same size to order these. They are a little bigger than expected but still comfortable.,I was really excited when I opened the box to see the color is exactly like the image shows ! but still comfortable .
142,19,5,5,Excellent ...!!!,Excellent ... ! ! !
74,3,5,5,Extremely comfortable sneaker!,Extremely comfortable sneaker !
18,28,4,4,I just wish they would not roll down.,I just wish they would not roll down .
294,19,4,4,Nike always makes a good shoe ..abit rough breaking them in but after 9 hours on my feet anyone's feet would hurt abit,Nike always makes a good shoe .. abit rough breaking them in but after 9 hours on my feet anyone 's feet would hurt abit
348,3,5,5,"Very lightweight. Normal Nike quality. Pink is very bright , colors look great together.","Pink is very bright , colors look great together ."
199,19,5,5,"Love these! I have 3 pairs...they're so comfortable - I'm on my feet all day & my feet actually don't hurt at the end of the day when I wear these :)
I've learned to get these 1/2 size smaller....I'm normally a size 7 and the 6 1/2 fit perfectly",Love these ! I have 3 pairs ... they are so comfortable - I am on my feet all day & my feet actually do not hurt at the end of the day and the 6 1/2 fit perfectly
203,7,4,4,The lines don't really show up unless there is a bright light on them. But other than that they are perfect. They are very True to size and are comfortable the first time you put them on.,The lines do not really show up unless there is a bright light on them . that they are perfect . They are very True to size and are comfortable the first time you put them on .
62,20,5,5,They are super comfortable. Loving them.,They are super comfortable . Loving them .
151,3,5,5,Love them!!,Love them ! !
137,9,5,5,Love the color and fit. I use them to work on at the gym on the treadmill and they are very light and comfortable.,Love the color and fit . and fit . I use them to work on at the gym on the treadmill and comfortable .
193,19,1,1,wrong shoes,wrong shoes
162,8,5,5,Fit like a dream! Great for cross-training/HITT videos I do everyday. Great for walking too. Look amazing!,Fit like a dream ! Great for cross - training / HITT videos I do everyday . Great for walking too . Look amazing !
183,6,2,2,"I bought these for gym training - weight class and dance class (body jam, Zumba) - and really wanted to like them, since I loved the color and the light weight feel. But when I worked out high impact, my toes tingled, went numb and cramped because the toe bed is very narrow. Also, there wasn't enough cushion for me. When doing lunges, the ball of my feet hurt. Can't return them because I wore them several times. These might be fine for someone with a narrow foot.","and dance class ( body jam , Zumba ) - and really wanted to like them , since I loved the color and the light weight feel . when I worked out high impact , my toes tingled , went numb and cramped Also , there was not enough cushion for me . When doing lunges , the ball of my feet hurt . These might be fine for someone with a narrow foot ."
304,7,5,5,"Comfortable shoe for both workout sessions and walking.  Neither too bulky nor too light.  This is my second pair because they fit and have no neon or pink colors, just nice basic B&W.","Comfortable shoe for both workout sessions Neither too bulky nor too light . because they fit and have no neon or pink colors , just nice basic B&W."
146,9,5,5,"I love these, I had the previous iteration (or maybe two earlier?) and finally wore them out after several years. They are definitely a light-weight training shoe so I wouldn't get them if you are going to be doing a lot of running. But this also makes them extremely comfortable, I hadn't realized how hot running shoes made my feet until I switched to these. Good support and my feet stay cool all day, also noticeably light but well-made and long lasting.

I have worn them hiking in a pinch but don't really recommend it because the material is mesh-like and will let a lot of dirt in. But if you mainly take cardio classes and/or do weight training or just need something to wear around town look no further.","I love these , I had the previous iteration ( They are definitely a light - weight training shoe But this also makes them extremely comfortable , I had not realized how hot running shoes made my feet until I switched to these . Good support and my feet stay cool all day , also noticeably light but well - made I have worn them hiking in a pinch but do not really recommend it because the material is mesh - like and will let a lot of dirt in . or just need something to wear around town look no further ."
177,8,3,3,"Meh, felt very comfortable but provided no support. Seem like a good option for walking around in the summer but not for aerobics or lateral movements","Meh , felt very comfortable but provided no support . Seem like a good option for walking around in the summer"
317,27,5,5,"Tried them on in a store before buying online so I knew they'd fit good. Overall I was looking for a durable cross training shoe that would hold up to my rigorous training and these have been great so far. They are really light and comfortable. Most importantly for me they have grips on the bottoms so my feet don't slide out from under me while doing planks, push-ups, etc. Highly satisfied with this purchase.","so I knew they would fit good . Overall I was looking for a durable cross training shoe that would hold up to my rigorous training and these have been great so far . and comfortable . Most importantly for me they have grips on the bottoms so my feet do not slide out from under me while doing planks , push - ups , etc . Highly satisfied with this purchase ."
17,20,5,5,"Nice shoes, fit good","Nice shoes, fit good"
324,7,4,4,Nice looking and fit nice,Nice looking and fit nice
351,9,5,5,Love them !!!,Love them ! ! !
350,25,3,3,Average product.  As described.,Average product . As described .
162,19,5,5,Fit like a dream! Great for cross-training/HITT videos I do everyday. Great for walking too. Look amazing!,Fit like a dream ! Great for cross - training / HITT videos I do everyday . Great for walking too . Look amazing !
315,7,5,5,"Super comfy, True Size , I use them for boot Camp,  cross fit and they are great , absolutely recommended it.","Super comfy , True Size , I use them for boot Camp ,   cross fit and they are great , absolutely recommended it ."
308,19,5,5,"Look better than the picture, very comfortable, great support.","Look better than the picture , very comfortable , great support ."
243,27,5,5,These shoes fit like a glove! Light but very supportive! I have worn them several times and feel very light on my feet.,These shoes fit like a glove ! but very supportive ! I have worn them several times
235,9,5,5,"A-MA-ZING!  I needed a good jogging shoe and these make me feel like ""Forest Gump"".  I felt like I was running on a cloud.  I have narrow feet and these fit perfectly.  I am so happy that I am going to purchase another two pair as back-ups for once it's time to replace them.  Highly recommend to women who like to walk or run and light a light weight, comfortable shoe.","I needed a good jogging shoe and these make me feel like "" Forest Gump "" . I felt like I was running on a cloud . and these fit perfectly . I am so happy Highly recommend to women who like to walk and light a light weight , comfortable shoe ."
392,27,5,5,"Size really depends on the brand.  I wear a 6.5 in Nike and they fit me perfectly.  These shoes are comfortable, they wrap around my feet like a bandage but do not restrict movement.","and they fit me perfectly . These shoes are comfortable , they wrap around my feet like a bandage but do not restrict movement ."
182,7,5,5,"Bought these for my daughter and she loves them.  She tried them on at a retail store a couple months prior, so I knew her exact size.",and she loves them .
178,19,5,5,"Love these shoes. I've been buying Nikes for years now. I bought this pair for work and everyday wear and another pair for working out and active wear. They also last a long time in my opinion, especially if you take care of them.","Love these shoes . I bought this pair for work and active wear . They also last a long time in my opinion , especially if you take care of them ."
346,8,5,5,Tried a lot of shoes for cross training and these were the best!,and these were the best !
164,6,5,5,Great shoes,Great shoes
23,6,4,4,"Perfect for the gym, could use a little more support in the toe area but very comfortable and light. Fit True to size.","Perfect for the gym , could use a little more support in the toe area but very comfortable Fit True to size ."
54,3,5,5,Great Gift - she loved it!  It's a nice shoe!,Great Gift - she loved it ! It is a nice shoe !
362,9,5,5,Super light weight comfortable! Kick box in these and run too. Good support!,Super light weight comfortable ! Good support !
114,8,5,5,I always order a 1/2 size up in workout shoes.,I always order a 1/2 size up in workout shoes .
351,6,5,5,Love them !!!,Love them ! ! !
267,6,5,5,"Obsessed with these shoes! I was looking for good all around sneakers (running, walking, tennis, etc.) and these more than fit the bill. I was looking specifically for black nikes (I love the fit) with white soles (good for court sports); I was a little reluctant to purchase because I wasn't sure whether the black on the soles would contact the ground, but it doesn't!","Obsessed with these shoes ! I was looking for good all around sneakers ( running , walking , tennis , etc . ) and these more than fit the bill . I was looking specifically for black nikes ( I love the fit ) with white soles ( good for court sports ) ; I was a little reluctant to purchase because I was not sure whether the black on the soles would contact the ground ,"
16,25,2,2,"Did not fit well. Was not comfortable. Switched to ""Fruit of the loom"". Fruit of the loom are somewhat oversized but fit well and are very comfortable.","Did not fit well . Was not comfortable . Switched to "" Fruit of the loom "" . Fruit of the loom are somewhat oversized but fit well and are very comfortable ."
310,3,5,5,"I had the older generation of this shoe that survived 2 or 3 mud runs and of all my aches and pains, my feet was not one of them. This is because of this shoe. Nike really dropped the mic with this.","that survived 2 and of all my aches and pains , my feet was not one of them ."
290,8,3,4,Nice,Nice
134,19,5,5,"I actually have 3 pairs of these trainers.  They are very comfortable, there is a neoprene sleeve that goes around your ankle that makes them the most comfortable for me compared to normal athletic shoes.  They run a little narrow - for me this is perfect, but you may want to round up on the size or try on in the store first if your feet are on the wider side.","They are very comfortable , there is a neoprene sleeve that makes them the most comfortable for me compared to normal athletic shoes . They run a little narrow - for me this is perfect , but you may want to round up on the size"
299,20,5,5,"I've had these shoes for about a week now and have so far enjoyed using them. Considering the fact that I have wide feet, the shoes are slightly tight. However, it doesn't feel uncomfortable nor does it bothers me as I use them throughout my workouts. I know some people personally like when the shoes are a bit tighter or a bit looser so it's all in personal preference.","and have so far enjoyed using them . However , it does not feel uncomfortable nor does it bothers me as I use them throughout my workouts . I know some people personally like"
270,25,5,5,Comfortable,Comfortable
325,7,5,5,"Great shoe, very comfortable","Great shoe, very comfortable"
46,6,5,5,"If you wear Nike on the regular, then you should pretty much know your size. I wear only 7's in Nike, and it fit just as expected. I have many of the trail runner generations, and love them all. they're my go to sneakers for the gym use, or casual wear. I have a pair I used mostly for casual wear that have lasted about 5 years. Another pair that I used for cross fit/outdoor runs that lasted a little over a year (very vigorous daily use). All in all, these shoes are great for me. They're lightweight, and comfortable.","If you wear Nike on the regular , then you should pretty much know your size . and it fit just as expected . and love them all . or casual wear . I have a pair I used mostly for casual wear that I used for cross fit / outdoor runs All in all , these shoes are great for me . and comfortable ."
395,19,5,5,The shoe fit has expected. It is comfortable.,The shoe fit has expected . It is comfortable .
231,8,4,4,It looks a bit nicer on the picture. Its very light in such a way that when I held the box I wondered if there was just paper filling inside. They are comfortable for the most. Good looking training shoes overall.,It looks a bit nicer on the picture . They are comfortable for the most . Good looking training shoes overall .
326,1,2,2,"This is my 6th pair and they are the best thing ever for my plantar fasciitis and resultant neuromas. Unfortunately, the ones I ordered from SmartDestination must be seconds as they kill my feet. The hard plastic insert rubs on the outside edges of my feet. I am unable to exchange them as I waited one day too late to use them in my walking shoes.","and they are the best thing ever for my plantar fasciitis Unfortunately , the ones I ordered from SmartDestination must be seconds as they kill my feet . The hard plastic insert rubs on the outside edges of my feet . I am unable to exchange them as I waited one day too late to use them in my walking shoes ."
64,19,5,5,"Absolutly love these shoes!! Beautiful color, comfy, and lightweight","Absolutly love these shoes ! ! Beautiful color , comfy ,"
304,3,5,5,"Comfortable shoe for both workout sessions and walking.  Neither too bulky nor too light.  This is my second pair because they fit and have no neon or pink colors, just nice basic B&W.","Comfortable shoe for both workout sessions Neither too bulky nor too light . because they fit and have no neon or pink colors , just nice basic B&W."
27,27,5,5,Love them!  I ordered an 8.5 because I usually wear that size but these are a bit big. I wish I ordered an 8. They are really comfortable and I enjoy wearing them.,Love them ! I wish I ordered an 8 . They are really comfortable and I enjoy wearing them .
277,27,5,5,Size 5. Very comfortable shoes. Love!,Very comfortable shoes . Love !
159,9,5,5,I really love these shoes.  They are attractive and very comfortable.  They work well for my daily workout and fit well.,I really love these shoes . They are attractive and very comfortable . They work well for my daily workout and fit well .
400,20,3,3,"Fit is fine, but not much cushioning in the footbed. The first time wearing them on a long walk I developed a blister on the bottom of my foot.","Fit is fine , The first time wearing them on a long walk I developed a blister on the bottom of my foot ."
12,20,5,5,I have gotten so many compliments on the blue color and look of this shoe.  It is super comfortable.  The grip is wonderful for my indoor gym cross training classes.  I always order a half size larger in Nike brand shoes and thy fit perfectly as I did with this shoe.,I have gotten so many compliments on the blue color and look of this shoe . It is super comfortable . The grip is wonderful for my indoor gym cross training classes . and thy fit perfectly as I did with this shoe .
105,20,1,1,"I loved these shoes...that is until after about an hour of wear, the green inserts on the sole of the right show began falling off. The wear was in my home, on smooth floors. I can only assume they were defective.","I loved these shoes ... that is until after about an hour of wear , the green inserts on the sole of the right show began falling off . The wear was in my home , on smooth floors . I can only assume they were defective ."
123,9,5,5,Absolutely love them. Can even wear them without my insoles.,Absolutely love them .
202,19,5,5,They were a gift  to my daughter she loved them,They were a gift  to my daughter she loved them
282,19,5,5,Love this shoes so comfy and great very everyday use. Runs big,Love this shoes so comfy and great very everyday use .
183,8,2,2,"I bought these for gym training - weight class and dance class (body jam, Zumba) - and really wanted to like them, since I loved the color and the light weight feel. But when I worked out high impact, my toes tingled, went numb and cramped because the toe bed is very narrow. Also, there wasn't enough cushion for me. When doing lunges, the ball of my feet hurt. Can't return them because I wore them several times. These might be fine for someone with a narrow foot.","and dance class ( body jam , Zumba ) - and really wanted to like them , since I loved the color and the light weight feel . when I worked out high impact , my toes tingled , went numb and cramped Also , there was not enough cushion for me . When doing lunges , the ball of my feet hurt . These might be fine for someone with a narrow foot ."
278,6,5,5,"These shoes are awesome!  They are nearly weightless and feel great on my feet.  The first day I wore them I wore them ALL day on vacation.  I put them on the next day and did the same.  Besides the comfort, they are really a cool color!","These shoes are awesome ! and feel great on my feet . Besides the comfort , they are really a cool color !"
344,7,5,5,They fit perfectly. These shoes are great for walking - so very comfortable. Love them.,They fit perfectly . These shoes are great for walking - so very comfortable . Love them .
405,27,5,5,Purchased for my daughter for gym class.  She loves them.  Very cute and very comfortable.,She loves them . Very cute and very comfortable .
60,3,5,5,Really comfy and nice color,Really comfy and nice color
196,7,5,5,Love my new Nike's.  It's been years since I've been able to wear them (sizing changed years ago and I just couldn't wear them any more) but now the new styles and sizing are perfect.  Lightweight shoe with tons of style.  The Fog color is just what I was looking for...not black and not neon!  I wore them to participate in Relay for Life (24 hour walk) and they held up great!,Love my new Nike 's . and sizing are perfect . and they held up great !
283,8,5,5,As expected.,As expected .
115,3,4,4,"They fit as expected and perfect for training, the shoelaces are a little bit too long. Other than that these shoes are as I expected them !","They fit as expected and perfect for training , the shoelaces are a little bit too long ."
220,6,3,3,"This is a shoe I will wear with black dress pants or jeans when I need comfort and a little style, but I am not impressed.  This is a very flimsy shoe with little support at all.  Not like any Nike I've ever purchased in the past.  It looks nice, but it's not comfortable.","when I need comfort but I am not impressed . This is a very flimsy shoe with little support at all . Not like any Nike It looks nice , but it is not comfortable ."
294,9,4,4,Nike always makes a good shoe ..abit rough breaking them in but after 9 hours on my feet anyone's feet would hurt abit,Nike always makes a good shoe .. abit rough breaking them in but after 9 hours on my feet anyone 's feet would hurt abit
404,27,5,5,Fit good,Fit good
363,20,5,5,Super comfy!!,Super comfy ! !
177,20,3,3,"Meh, felt very comfortable but provided no support. Seem like a good option for walking around in the summer but not for aerobics or lateral movements","Meh , felt very comfortable but provided no support . Seem like a good option for walking around in the summer"
343,8,5,5,Comfortable from the start and very light.,Comfortable from the start
204,19,5,5,"I love these shoes and have worn them for a long time. That are comfy, thinner on the top & sole and are very cute!","I love these shoes and have worn them for a long time . That are comfy , thinner on the top & sole and are very cute !"
240,8,5,5,good quality,good quality
121,7,5,5,These shoes are awesome!!,These shoes are awesome ! !
59,3,1,1,Ordered 9(m) received 9 Wide for the second time. Returned them for the second time.,Ordered 9(m ) received 9 Wide for the second time . Returned them for the second time .
356,20,5,5,Great product and fast shipping!,Great product and fast shipping !
279,9,1,3,I usually wear a size 8 and they fit fine. These are way too narrow. Thought they might stretch out but they didnt. Had to give away.,and they fit fine .
175,8,5,5,"Straight out of the box, these shoes are great! Very lightweight and fits comfortably on my feet like a glove! I love most especially that the sole is not bulky like my previous running shoes  I hated those things lol! I would give them a shot and they are great for the price!","Straight out of the box , these shoes are great ! and fits comfortably on my feet like a glove ! I love most especially that the sole is not bulky like my previous running shoes   I hated those things lol ! and they are great for the price !"
227,6,1,1,They looked very cheap,They looked very cheap
108,19,5,5,Love these shoes. My feet feel so much better. Lots of padding and light enough to run in.,Love these shoes . My feet feel so much better . and light enough to run in .
52,19,5,5,Super comfy!,Super comfy !
167,19,5,5,Just what I needed for Group Fight class. Quick movements and footwork are so easy in these sneakers. Love them.,Just what I needed for Group Fight class . and footwork are so easy in these sneakers . Love them .
285,7,3,3,After my purchased I found out they are overpriced. They feel good but I will not recommended if you need Wide fit.,After my purchased I found out they are overpriced . They feel good but I will not recommended if you need Wide fit .
220,27,3,3,"This is a shoe I will wear with black dress pants or jeans when I need comfort and a little style, but I am not impressed.  This is a very flimsy shoe with little support at all.  Not like any Nike I've ever purchased in the past.  It looks nice, but it's not comfortable.","when I need comfort but I am not impressed . This is a very flimsy shoe with little support at all . Not like any Nike It looks nice , but it is not comfortable ."
40,20,5,5,"They fit perfect, extremely comfortable","They fit perfect, extremely comfortable"
118,27,5,5,Purchased these for my wife as she has a similar pair that is wearing out.  She has feet are difficult to fit and these fit perfectly without pressure on sensitive portions of her feet.,She has feet are difficult to fit and these fit perfectly without pressure on sensitive portions of her feet .
315,8,5,5,"Super comfy, True Size , I use them for boot Camp,  cross fit and they are great , absolutely recommended it.","Super comfy , True Size , I use them for boot Camp ,   cross fit and they are great , absolutely recommended it ."
395,7,5,5,The shoe fit has expected. It is comfortable.,The shoe fit has expected . It is comfortable .
190,27,3,3,Very low cut heel so if you training and pushing sleds - I ran right out of shoes! Although the traction on toe and heel are great,Very low cut heel so if you training and pushing sleds - I ran right out of shoes ! Although the traction on toe and heel are great
341,27,5,5,Look great,Look great
80,20,5,5,"Great shoe! Outside arch is kind of high, but I'm still breaking them in. So I'm sure that will work it's way out. I originally ordered a 9, my regular size, and it was a tad too big. Returned and ordered an 8.5 and it fits perfect!","Great shoe ! Outside arch is kind of high , but I am still breaking them in . So I am sure that will work it is way out . and it fits perfect !"
157,27,5,5,Luv them!!,Love them ! !
188,8,5,5,Perfect!,Perfect !
340,3,5,5,I love my tennis shoes,I love my tennis shoes
26,20,5,5,"Love these, comfortable, light weight, great fit.","Love these , comfortable , light weight , great fit ."
