reviewerID,asin,overall,overall_new,reviewText,filteredReviewText
124,3,5,5,"This is the most comfortable shoe I've ever had. No other shoe can compare to how the individual nubs on the bottom allow your foot to be cushioned, yet work like it's suppose to. My feet feel cradled in this shoe and hard surfaces don't make my feet ache anymore.

These shoes have a small amount of support, but not much, which I like as I'm coming from vibram five fingers. (Sorry vffs, I'm bailing after 2 years of shin splints, no matter what I did).

Highly recommended for walking/running on concrete or tracks. As long as nike continues to make the flex supreme, they will get my money. Please don't change this shoe!","This is the most comfortable shoe I have ever had . No other shoe can compare to how the individual nubs on the bottom allow your foot to be cushioned , yet work like it is suppose to . and hard surfaces do not make my feet ache anymore . These shoes have a small amount of support , which I like as I am coming from vibram five fingers . ( Sorry vffs , I am bailing after 2 years of shin splints , no matter what I did ) . Highly recommended for walking / running on concrete As long as nike continues to make the flex supreme , they will get my money . Please do not change this shoe !"
320,9,4,4,"i bought a pair from DSW for 50$ and they are very comfortable but i bought a size 6.5 when I normally where a size 7.  and even the 6.5 feels a little roomy.  I have wide flat feet btw.  im not sure if I will keep them even though i love their look and comfort.  I've been having feet problems while taking a gym class and I think they won't give me enough support when running.  they're great for wearing at home or gym and doing exercises in one place- extremely light weight and flexible, but i don't know if they'll last long if you use them everywhere else.  :(  i really like them but i cant just buy 2 different shoes.
also, i really like the strings inside the lining on the side of the shoes to adjust and make the shoe fit snug. it makes me feel secure :D","and they are very comfortable and even the 6.5 feels a little roomy . i am not sure if I will keep them even though i love their look and comfort . I have been having feet problems while taking a gym class and I think they will not give me enough support they are great for wearing at home and flexible , i really like them also , i really like the strings inside the lining on the side of the shoes to adjust and make the shoe fit snug . it makes me feel secure :D"
244,20,5,5,I bought these for my wife. She saw them in the store but did not have their size so i ordered on amazon. She loves them . She already had for a couple of months and no complains at all. One of her favorites shoes for running or for her job since she walks a lot in the warehouse. Now she loves me more. :),but did not have their size so i ordered on amazon . She loves them . and no complains at all . One of her favorites shoes for running Now she loves me more .
250,6,5,5,"Love these shoes, I have worn them all day and found them really comfortable with no aching feet at the end of the day. Fantastic colour and True to size. I also bought  Nike Women's Flex Supreme Tr 3 Pnk Pw/Mtllc Slvr/Cl Gry/White Training Shoe and these shoes are slightly more comfortable than those even though they look very similar.","Love these shoes , I have worn them all day and found them really comfortable with no aching feet at the end of the day . Fantastic colour and True to size . I also bought   Nike Women 's Flex Supreme Tr 3 Pnk Pw / Mtllc Slvr / Cl Gry / White Training Shoe and these shoes are slightly more comfortable than those even though they look very similar ."
54,19,5,5,Great Gift - she loved it!  It's a nice shoe!,Great Gift - she loved it ! It is a nice shoe !
199,27,5,5,"Love these! I have 3 pairs...they're so comfortable - I'm on my feet all day & my feet actually don't hurt at the end of the day when I wear these :)
I've learned to get these 1/2 size smaller....I'm normally a size 7 and the 6 1/2 fit perfectly",Love these ! I have 3 pairs ... they are so comfortable - I am on my feet all day & my feet actually do not hurt at the end of the day and the 6 1/2 fit perfectly
89,27,5,5,"Favorite training and walking-around sneakers.
They look good with just about anything, and are comfortable for most situations.
With the exception of running (for which I use proper Mizuno running sneakers with an arch-support insole), these sneakers are my go-to.
If I could, I'd take away a 1/2 star for arch support - I have a slightly wider front of the foot and arches that are a little on the high side, so I do look for a good under the foot fit. I could probably tie the laces differently or put in an insole(they're pretty expensive), but as is, when I did a zumba class in these, my arch began to twinge :(
However, this is overall an awesome shoe that I will continue to stick with for going out, day to day walking, and for training and gym use (with the exception of running and zumba (although hip-hop was fine). The shoes have a great flexibility to them and don't look ""dirty"" easily. My previous pair of flex supreme TR 3s have lasted for a good 2 years and are just now on the verge of being worn out. This is the optimal sneaker that is flexible in more ways than one: from pointing you toes to leg-pressing, from gym use to shopping to adding a sporty edge to a dressy night out, the flex has it all.","Favorite training They look good with just about anything , and are comfortable for most situations . With the exception of running ( for which I use proper Mizuno running sneakers with an arch - support insole ) , these sneakers are my go - to . which I use proper Mizuno running sneakers with an arch - support insole ) , these sneakers are my go - to . If I could , I would take away a 1/2 star for arch support - I have a slightly wider front of the foot that are a little on the high side , so I do look for a good under the foot fit . or put in an insole(they are pretty expensive ) , However , this is overall an awesome shoe although hip - hop was fine ) . The shoes have a great flexibility to them and do not look "" dirty "" easily . My previous pair of flex supreme TR 3s have lasted for a good 2 years and are just now on the verge of being worn out . This is the optimal sneaker that is flexible in more ways than one : from pointing you toes to leg - pressing , from gym use to shopping to adding a sporty edge to a dressy night out , the flex has it all ."
374,7,5,5,Fit my size perfectly and very comfortable!,Fit my size perfectly and very comfortable !
190,20,3,3,Very low cut heel so if you training and pushing sleds - I ran right out of shoes! Although the traction on toe and heel are great,Very low cut heel so if you training and pushing sleds - I ran right out of shoes ! Although the traction on toe and heel are great
198,19,5,5,excelente,excelente
275,9,5,5,Arrived in time. Fit as exoected. They take some breaking in but I wore them 2 days in a row for more than five hours per day.,Fit as exoected . They take some breaking in
46,9,5,5,"If you wear Nike on the regular, then you should pretty much know your size. I wear only 7's in Nike, and it fit just as expected. I have many of the trail runner generations, and love them all. they're my go to sneakers for the gym use, or casual wear. I have a pair I used mostly for casual wear that have lasted about 5 years. Another pair that I used for cross fit/outdoor runs that lasted a little over a year (very vigorous daily use). All in all, these shoes are great for me. They're lightweight, and comfortable.","If you wear Nike on the regular , then you should pretty much know your size . and it fit just as expected . and love them all . or casual wear . I have a pair I used mostly for casual wear that I used for cross fit / outdoor runs All in all , these shoes are great for me . and comfortable ."
399,2,3,3,Not pretty for fashion but great around the house and work.,Not pretty for fashion but great around the house and work .
376,19,5,5,This is a very attractive shoe. It is True to size and fits as expected. Very satisfied with the seller - delivered on time.,This is a very attractive shoe . It is True to size Very satisfied with the seller - delivered on time .
95,19,5,5,"Love it!! Super comfortable and nice!! Got more than I expected, super flexible great for training. Definetly recommend it.","Love it ! ! Super comfortable and nice ! ! Got more than I expected , super flexible great for training . Definetly recommend it ."
326,12,5,5,"Pinnacle seems to have more cushioning so my husband likes them better. He's tried all the other Powerstep inserts as well as other brands. This is his must have insert. He is 6'3"" and weighs 257lbs with bone spurs (plantar fasciitis) and a high instep. He is very active and wears these in all his shoes. His bone spurs rarely bother him any more. Remember to replace them every 3 months if you wear them every day, especially if you weigh more than average and/or run.",Pinnacle seems to have more cushioning so my husband likes them better . He is tried all the other Powerstep inserts as well as other brands . He is very active His bone spurs rarely bother him any more .
308,9,5,5,"Look better than the picture, very comfortable, great support.","Look better than the picture , very comfortable , great support ."
138,8,3,4,"Bought these shoes with HIIT in mind, but not too sure how I like the fit on my foot. First time to wear them, not great for running. Maybe after they're broken in a little they'll get better. If you just need a comfortable pair of shoes for walking, they're fine.","but not too sure how I like the fit on my foot . First time to wear them , not great for running . Maybe after they are broken in a little they will get better . If you just need a comfortable pair of shoes for walking , they are fine ."
244,19,5,5,I bought these for my wife. She saw them in the store but did not have their size so i ordered on amazon. She loves them . She already had for a couple of months and no complains at all. One of her favorites shoes for running or for her job since she walks a lot in the warehouse. Now she loves me more. :),but did not have their size so i ordered on amazon . She loves them . and no complains at all . One of her favorites shoes for running Now she loves me more .
315,9,5,5,"Love them absolutely comfortable. I'm very picky with sneakers and this ones for the price are great I use them for cross fit , boot camp & they work great . The sole is very flexible , True size . I have a wide feet and they fit perfectly. Very nice looking Great sneakers.","Love them absolutely comfortable . I am very picky with sneakers and this ones for the price are great I use them for cross fit , boot camp & they work great . The sole is very flexible , True size . and they fit perfectly . Very nice looking Great sneakers ."
291,7,5,5,Perf.,Perf .
47,8,5,5,My favorite cross trainers!,My favorite cross trainers !
305,20,5,5,Bought these as my back up shoes but they have turned into my daily ones I go to! So comfortable and my feet don't hurt after long hours on my feet. I own a cleaning business so I need my feet not to hurt in the middle of the day.,So comfortable and my feet do not hurt after long hours on my feet . so I need my feet not to hurt in the middle of the day .
259,7,3,4,"Good indoor training shoes for running on treadmill, doing lunges and regular exercises at the gym. These are very flexible, light weight and comfortable. Grip is okay - sticky rubber is used only at the edges of heel and toe areas so I slipped a little when I worked on cable machines, resistance band, etc. on un-carpeted floor.  I would emphasize that if you do lifting as a part of your everyday routine workout I would not recommend them because mine (cushion) lasted only for six months and this is the reason I gave three stars. Other than that, I liked them!","Good indoor training shoes for running on treadmill , doing lunges These are very flexible , light weight and comfortable . Grip is okay - sticky rubber is used only at the edges of heel when I worked on cable machines , resistance band , etc . on un - carpeted floor . that if you do lifting as a part of your everyday routine workout I would not recommend them that , I liked them !"
269,27,5,5,"On time, nice sneakers. Fit as expected.","On time , nice sneakers . Fit as expected ."
359,20,5,5,Great fit so comfortable love them!!!!!,Great fit so comfortable love them ! ! ! ! !
34,27,5,5,The color pattern and fit is what I liked the most what I liked the least is that they are not easy to clean and stains do not come out very easy or at all,and fit is what I liked the most what I liked the least is that they are not easy to clean and stains do not come out very easy
171,27,3,3,"I was shocked at how small these shoes were, not True at all to size, and I own multiple shoes in this brand. The quality could have been better, in my opinion -- very little support from the upper.","I was shocked at how small these shoes were , not True at all to size , The quality could have been better , in my opinion -- very little support from the upper ."
393,3,5,5,Excelente,Excelente
140,19,5,5,The fit is as expected,The fit is as expected
125,27,3,3,The material is real then hope they don't fall apart . to expensive for what you get.,The material is real then hope they do not fall apart . to expensive for what you get .
353,7,5,5,Love them fit perfect,Love them fit perfect
206,8,4,4,A nice lightweight shoe. Not a lot of cushion so I wouldn't run long distances in them.,A nice lightweight shoe .
374,9,5,5,Fit my size perfectly and very comfortable!,Fit my size perfectly and very comfortable !
307,19,4,4,"Arrived on time. I probably should have gone with a 7.5 instead of an 8 because they do seem a little big, but if I wear thick socks they are fine. Also, they can sometimes make a very annoying squeaky noise when I run on certain surfaces so I'm trying to get them worn in. Over-all, I am satisfied with my purchase!","but if I wear thick socks they are fine . Also , they can sometimes make a very annoying squeaky noise when I run on certain surfaces so I am trying to get them worn in . Over - all , I am satisfied with my purchase !"
369,7,5,5,BEST sneakers I've ever purchased!!!!,BEST sneakers I have ever purchased ! ! ! !
402,19,5,5,Very comfortable shoes. I have wide feet with falling arches. These help both and are comfortable enough that I can be in them all day long.,Very comfortable shoes . I have wide feet with falling arches . These help both and are comfortable enough
318,7,4,4,Not a lot of arch support but really lightweight.,Not a lot of arch support
201,8,5,5,She loves them,She loves them
69,9,5,5,Love these! Super light and comfortable!,Love these ! Super light and comfortable !
379,9,2,2,I returned these as they were not True to size. They ran large.,I returned these as they were not True to size .
96,20,5,5,i love these shoes.,i love these shoes .
205,3,1,1,After using this shoes seven times for regular activities like walking or dancing the sole came out. I am very disappointed. I don't recommend this product at all. The worse part is that I can not return this item because the return window closed 4 days ago.,After using this shoes seven times for regular activities like walking I am very disappointed . I do not recommend this product at all . The worse part is
106,7,3,3,I returned them...found a Ryka pair I liked better,I returned them ... found a Ryka pair I liked better
399,30,3,3,Not pretty for fashion but great around the house and work.,Not pretty for fashion but great around the house and work .
308,20,5,5,"Look better than the picture, very comfortable, great support.","Look better than the picture , very comfortable , great support ."
45,27,5,5,Love them,Love them
140,27,5,5,The fit is as expected,The fit is as expected
375,8,5,5,"Just because they are white, they do need a washing regularly but I have received many compliments on how pretty these white and pink shoes are. Extremely good Nike quality. Highly recommended.",but I have received many compliments on how pretty these white Extremely good Nike quality . Highly recommended .
108,20,5,5,Love these shoes. My feet feel so much better. Lots of padding and light enough to run in.,Love these shoes . My feet feel so much better . and light enough to run in .
306,20,5,5,Fit well.,Fit well .
171,3,3,3,"I was shocked at how small these shoes were, not True at all to size, and I own multiple shoes in this brand. The quality could have been better, in my opinion -- very little support from the upper.","I was shocked at how small these shoes were , not True at all to size , The quality could have been better , in my opinion -- very little support from the upper ."
126,27,5,5,Fit comfortable,Fit comfortable
235,8,5,5,"A-MA-ZING!  I needed a good jogging shoe and these make me feel like ""Forest Gump"".  I felt like I was running on a cloud.  I have narrow feet and these fit perfectly.  I am so happy that I am going to purchase another two pair as back-ups for once it's time to replace them.  Highly recommend to women who like to walk or run and light a light weight, comfortable shoe.","I needed a good jogging shoe and these make me feel like "" Forest Gump "" . I felt like I was running on a cloud . and these fit perfectly . I am so happy Highly recommend to women who like to walk and light a light weight , comfortable shoe ."
122,7,5,5,"I love these!  I ordered an 8.5 which is my normal shoe size and they fit great.  I used them for my strength training class and they performed well, and they are sooooo pretty!  Comfortable, low profile and stylish!","I love these ! and they fit great . I used them for my strength training class and they performed well , and they are sooooo pretty ! Comfortable , low profile and stylish !"
359,6,5,5,Great fit so comfortable love them!!!!!,Great fit so comfortable love them ! ! ! ! !
173,7,4,4,Nice product,Nice product
375,6,5,5,"Just because they are white, they do need a washing regularly but I have received many compliments on how pretty these white and pink shoes are. Extremely good Nike quality. Highly recommended.",but I have received many compliments on how pretty these white Extremely good Nike quality . Highly recommended .
278,19,5,5,"These shoes are awesome!  They are nearly weightless and feel great on my feet.  The first day I wore them I wore them ALL day on vacation.  I put them on the next day and did the same.  Besides the comfort, they are really a cool color!","These shoes are awesome ! and feel great on my feet . Besides the comfort , they are really a cool color !"
9,9,1,1,Artculo equivocado en color,Artculo equivocado en color
328,3,5,5,"So comfortable, I don't even feel like I have a sneaker on. Based on the other reviews I got a half a size up and glad I did.","So comfortable , I do not even feel like I have a sneaker on . and glad I did ."
210,3,3,3,"On the left shoe, there were two stained yellow spots.","On the left shoe , there were two stained yellow spots ."
153,20,5,5,Really comfortable and very cute.,Really comfortable and very cute .
378,17,5,5,looks great,looks great
224,27,3,3,Fit fine...did not like color in person,Fit fine ... did not like color in person
259,8,3,4,"Good indoor training shoes for running on treadmill, doing lunges and regular exercises at the gym. These are very flexible, light weight and comfortable. Grip is okay - sticky rubber is used only at the edges of heel and toe areas so I slipped a little when I worked on cable machines, resistance band, etc. on un-carpeted floor.  I would emphasize that if you do lifting as a part of your everyday routine workout I would not recommend them because mine (cushion) lasted only for six months and this is the reason I gave three stars. Other than that, I liked them!","Good indoor training shoes for running on treadmill , doing lunges These are very flexible , light weight and comfortable . Grip is okay - sticky rubber is used only at the edges of heel when I worked on cable machines , resistance band , etc . on un - carpeted floor . that if you do lifting as a part of your everyday routine workout I would not recommend them that , I liked them !"
191,27,5,5,"Great shoe. I've had Nike's before and have always been pleased with the comfort, performance, and quality. Though I will say this was the first time I ordered a pair online without trying them on first, so I was nervous. But this turned out to be a great choice. Breathable, lightweight but sturdy, and comfortable during all my workouts. The built-in arch support is great and I've had no discomfort after 2 weeks of use. As far as the sole thickness and cushioning goes, I would consider these a 'medium' build (not thin, not overly thick) so if you're into heavy running outdoors then take that into consideration. Everyone is different in their preference for cushioning, but I think for light runs on a treadmill they would be sufficient. Love these, highly recommend!","Great shoe . and have always been pleased with the comfort , performance , Though I will say this was the first time I ordered a pair online without trying them on first , so I was nervous . But this turned out to be a great choice . but sturdy , and comfortable during all my workouts . The built - in arch support is great and I have had no discomfort after 2 weeks of use . but I think for light runs on a treadmill they would be sufficient . Love these , highly recommend !"
364,7,5,5,"fits perfect, my daughter loves them","fits perfect, my daughter loves them"
84,27,5,5,Very confortable.,Very confortable .
309,3,5,5,Love these shoes!,Love these shoes !
142,20,5,5,Excellent ...!!!,Excellent ... ! ! !
186,3,5,5,I love the shoe and it fit as expected the photos and description are accurate if you're looking for a shoe that has more cushion or support try a different style but as far as wanting a lightweight and breathable shoe this is it. I am very satisfied with this purchase,I love the shoe and it fit as expected the photos and description are accurate if you are looking for a shoe or support try a different style I am very satisfied with this purchase
386,7,5,5,"Super comfortable and fit my small feet perfectly. I have flat feet so a lot of shoes are not comfortable for long periods of time. I can wear the shoe all day long and they are super comfortable. They are light colored so any dirt will be seen right away, but they are easy to clean compared to other shoes Ive had. Would definitely buy another pair in a different color.","Super comfortable and fit my small feet perfectly . I have flat feet so a lot of shoes are not comfortable for long periods of time . and they are super comfortable . They are light colored so any dirt will be seen right away , but they are easy to clean compared to other shoes I Have had . Would definitely buy another pair in a different color ."
289,7,5,5,I have been wearing for a solid week during my work outs & they are great for comfort and they are light weight.,I have been wearing for a solid week during my work outs & they are great for comfort
175,9,5,5,"Straight out of the box, these shoes are great! Very lightweight and fits comfortably on my feet like a glove! I love most especially that the sole is not bulky like my previous running shoes  I hated those things lol! I would give them a shot and they are great for the price!","Straight out of the box , these shoes are great ! and fits comfortably on my feet like a glove ! I love most especially that the sole is not bulky like my previous running shoes   I hated those things lol ! and they are great for the price !"
82,3,3,4,"Super cute shoe however runs wide and big, I'm a size 10 however this size 10 is too big. I went to a sporting goods store and tried the same shoe on  turns out with this particular shoe I'm a 9.5, so order half the size u normally are.",Super cute shoe
202,27,5,5,They were a gift  to my daughter she loved them,They were a gift  to my daughter she loved them
47,20,5,5,My favorite cross trainers!,My favorite cross trainers !
246,3,5,5,So lightweight and awesome!,and awesome !
106,27,3,3,I returned them...found a Ryka pair I liked better,I returned them ... found a Ryka pair I liked better
321,8,1,1,"I wore these shoe one time, from the airport in Omaha, NE to the airport in Phoenix, AZ. When I arrived in Phoenix, the left shoe/sole started squeaking and won't stop. I want to return for a refund. Need instructions for returning as no paperwork was in my package when it arrived.",and will not stop . I want to return for a refund . Need instructions for returning as no paperwork was in my package
184,9,3,4,ok but too big,ok
298,8,3,3,Squeaky,Squeaky
